{
  "schema": "MathScope.FinalHandoffAddendumInput/3",
  "state": "PREPARING_WAITING_FOR_ACTUAL_FOLLOWUP_N106",
  "preparedUTC": "2026-10-10T02:05:13.754407+00:00",
  "finalizedUTC": null,
  "intendedOutput": "/workspace/scratch/9a6c38c54c2e/output/pdf/MathScope_M0_M1_Handoff_2026-10-10_KO.pdf",
  "baseReport": {
    "path": "/workspace/scratch/9a6c38c54c2e/output/pdf/MathScope_M0_M1_Followup_2026-10-10_KO.pdf",
    "sha256": "cad9a136c0f4986f16f7f2347e5fc45441f230687e6f544a89e19354ea332888"
  },
  "baseVisualQA": {
    "path": "/workspace/scratch/9a6c38c54c2e/MathScopeCompute/research-ide/mathscope-m1/navier/followup-20261010-final-stress-audit/report/qa/0002/receipt.json",
    "sha256": "64eada7bf18d0ac372c54c4b67ebf8e8a89584266af2d242f429f4f7c1fa6a3d"
  },
  "historicalAssessment68_2": {
    "path": "/workspace/scratch/9a6c38c54c2e/MathScopeCompute/research-ide/mathscope-m1/navier/followup-20261010-final-stress-audit/ORIGINAL_NINE_GATES_ASSESSMENT_2026_10_10.json",
    "sha256": "913faa68844dc0f8108ea6b3e0a2144dfcd6e2d2213c4861954f67e99ab476a9"
  },
  "assessment69_1": {
    "path": "/workspace/scratch/9a6c38c54c2e/MathScopeCompute/research-ide/mathscope-m1/navier/followup-20261010-final-stress-audit/ORIGINAL_NINE_GATES_ASSESSMENT_2026_10_10_3.json",
    "sha256": "e57681b7bb751967b406ad440942728ecfd8fe47eb9672129ff19c8a7eb6634c"
  },
  "originalCriteria": {
    "path": "/workspace/scratch/9a6c38c54c2e/MathScopeCompute/research-ide/mathscope-m1/evidence/original-acceptance.json",
    "sha256": "854f67efad0f6d0cda7ab784611e5352b753ddd297fbac5a1382f4032ba02dc2"
  },
  "originalNsGates": {
    "path": "/workspace/scratch/9a6c38c54c2e/MathScopeCompute/research-ide/docs/NS_GATES_EN.md",
    "sha256": "57e993971939ef47ad5d81506e3e568ff256c4621bc5ade091c6e089ba895080"
  },
  "newAssessmentAfterComparator": null,
  "preservationPolicy": {
    "modifyFrozenRepositoryFiles": false,
    "replaceOriginal15PagePDF": false,
    "frozenCounts": [
      61,
      7,
      2
    ],
    "historicalCounts": [
      68,
      2,
      0
    ],
    "currentBeforeFinalComparator": [
      69,
      1,
      0
    ],
    "allOriginalConditionsCompleteWithoutNewN106Evidence": false,
    "conditionalN106PassRequiresIndependentArtifactAuditAndNewUnchangedCriteriaAssessment": true
  },
  "renderingPlan": {
    "appendixPages": 2,
    "mergedPagesWhenFinalized": 17,
    "supportedAppendixPages": [
      2,
      3
    ],
    "noPDFBeforeActualFinalGateEvidence": true,
    "followupPublicationRequiresThirdPage": true,
    "requiredFinalQA": "Render all 17 or 18 pages. Compare the first 15 to frozen originals and inspect every new page, table, URL, footer, glyph and margin. No visual QA or PDF creation has occurred for v2."
  },
  "displayTimezone": "Asia/Seoul",
  "displayTimeRule": "KST is the primary reader-facing time; retain the full raw UTC time in parentheses. Evidence timestamps remain unchanged.",
  "publication3Frozen": {
    "mainCommit": "c61d35806bb3579131eb7ff8c55187ae26209ade",
    "tree": "dec1b5e96dc7a6c02ac5139dd9d7eee5e453dd98",
    "tag": "mathscope-research-en-2026.10.10.3",
    "releaseId": 408456908,
    "assetId": 626581803,
    "prerelease": true,
    "releaseURL": "https://github.com/leegahuyn/MathScopeCompute/releases/tag/mathscope-research-en-2026.10.10.3",
    "downloadURL": "https://github.com/leegahuyn/MathScopeCompute/releases/download/mathscope-research-en-2026.10.10.3/MathScope_M0_M1_English_Full.zip",
    "mainPublicationReceipt": {
      "path": "/workspace/scratch/9a6c38c54c2e/tmp/release-validation-20261010/main-publication.json",
      "sha256": "ffc49ccf5d1ab44d4d587fc7bc83ac08693a7507fed217ba97856b3c4156bfa8"
    },
    "downloadVerification": {
      "path": "/workspace/scratch/9a6c38c54c2e/tmp/release-validation-20261010/published-download-verification.json",
      "sha256": "6333d017b716a10aeeda87b86df2984049f8afd4f71f5c1793bc0045967f83a6"
    },
    "publishedCI": {
      "path": "/workspace/scratch/9a6c38c54c2e/tmp/release-validation-20261010/published-ci-verification.json",
      "sha256": "f98b804d42a84c36fdc039648baea93cadab497c09da5ac8938d4959203a2500"
    },
    "localZIP": {
      "path": "/workspace/scratch/9a6c38c54c2e/MathScopeCompute/research-ide/dist/MathScope_M0_M1_English_Full.zip",
      "sha256": "94bb85e441a322cd57102b5fc2bfb159d53f82b37c35de119f79a97d9f4447c8"
    },
    "downloadedZIP": {
      "path": "/workspace/scratch/9a6c38c54c2e/tmp/release-validation-20261010/downloaded-MathScope_M0_M1_English_Full.zip",
      "sha256": "94bb85e441a322cd57102b5fc2bfb159d53f82b37c35de119f79a97d9f4447c8"
    },
    "metadataOrigin": "The parent confirmed the actual GitHub release API observation: release id, tag, target, prerelease flag and URL. Download and three-CI receipts are separately byte pinned. In v2, the historical local dist path is not re-read: a later .4 build may replace dist. The actual frozen public download and the prior local/public comparison receipt remain byte-verified."
  },
  "publicationFollowup": null,
  "oldFailedExecution": {
    "role": "HISTORICAL_FAILED_RUN_ONLY",
    "runId": 37979127351,
    "jobId": 113984853927,
    "artifactId": 11654200401,
    "preservationReceipt": {
      "path": "/workspace/scratch/9a6c38c54c2e/MathScopeCompute/research-ide/mathscope-m1/navier/followup-20261010-comparator-transport/old-run-0001/preservation-receipt.json",
      "sha256": "4feddf1cbbda6b42b56123783fb73432d6d191227d3e498ed6a213f6ff6c0166"
    },
    "finalObservation": {
      "path": "/workspace/scratch/9a6c38c54c2e/MathScopeCompute/research-ide/mathscope-m1/navier/followup-20261010-comparator-transport/old-run-0001/raw/github-observation-025.json",
      "sha256": "e93a2f3205c12b2aa4a200724f7ca1d2d6119d1ed34354270b062303f1442fa3"
    },
    "independentAudit": {
      "path": "/workspace/scratch/9a6c38c54c2e/MathScopeCompute/research-ide/mathscope-m1/navier/followup-20261010-comparator-transport/old-run-0001/raw/final-artifact-0001/comparator-portable-audit.json",
      "sha256": "d63ee66217a2b4dea4a81c7b91cb7e762ac7c2b52c48828960c4fca3cbfbbbbe"
    },
    "receivedReceipt": {
      "path": "/workspace/scratch/9a6c38c54c2e/MathScopeCompute/research-ide/mathscope-m1/navier/followup-20261010-comparator-transport/old-run-0001/raw/final-artifact-0001/receipt.json",
      "sha256": "1bfa73d215a287183fc554c0d1a965ed2955b08eabe8475b0f737b8920e28715"
    },
    "artifactZIP": {
      "path": "/workspace/scratch/9a6c38c54c2e/MathScopeCompute/research-ide/mathscope-m1/navier/followup-20261010-comparator-transport/old-run-0001/raw/final-artifact-0001/original-comparator-37979127351-1.zip",
      "sha256": "1af31713f8f021605af509bab4634fed7ab041636f6f1670be2bd3e3c61788d2"
    }
  },
  "diagnosticHistory": [
    {
      "role": "TRANSPORT_DIAGNOSTIC_ONLY",
      "runId": 38013278865,
      "jobId": 114097893399,
      "observation": {
        "path": "/workspace/scratch/9a6c38c54c2e/tmp/ns-guard-repair-20261010/remote-diagnostic-0001/observation-004.json",
        "sha256": "372377df45892005b64a84f6eb3113c355af115cdac7764f15838390394d3bbe"
      }
    }
  ],
  "gateExecution": {
    "role": "ORIGINAL_PROTECTED_COMPARATOR_GATE",
    "runId": 38014602021,
    "jobId": 114101981614,
    "artifactId": null,
    "headCommit": "55dacb898f8c204bf0c5925ea901d75d6c2d0f46",
    "finalObservation": null,
    "independentAudit": null,
    "auditVerifier": {
      "path": "/workspace/scratch/9a6c38c54c2e/MathScopeCompute/research-ide/mathscope-m1/navier/followup-20261010-comparator-transport/verify_n106_terminal_artifact.py",
      "sha256": "81c7991b62e2c9d7a88be179b5ae6d94ca7b9cf2726a8655d3ee512e795d00ef"
    },
    "auditInputsManifest": {
      "path": "/workspace/scratch/9a6c38c54c2e/MathScopeCompute/research-ide/mathscope-m1/navier/followup-20261010-n1-final/comparator-auditor-inputs/manifest.json",
      "sha256": "48341732c4eac4a991ed5b65b786beedc9f1d7098a97698ce99c89dead22a273"
    },
    "artifactZIP": null,
    "findingsKO": [],
    "expectedAuditSchema": "MathScope.OriginalProtectedComparatorTerminalAudit/1",
    "actualRunBinding": {
      "path": "/workspace/scratch/9a6c38c54c2e/MathScopeCompute/research-ide/mathscope-m1/navier/followup-20261010-comparator-transport/terminal-auditor-inputs/actual-run-binding.json",
      "sha256": "5f728471bfac35a987f927fccb722452f60635f5a2707cb2b4cf1c8bc646bcab"
    },
    "actualJobStatus": null,
    "actualJobConclusion": null
  }
}
